,job_description,bag_of_words
347,"Senior Internal Auditor / IT AuditMulti-billion-dollar Insurance company is seeking a Senior Internal Auditor to join there Boston Team. The Senior Internal Auditor will be responsible for performing internal audit projects, as part of the comprehensive internal audit plan. This will be a blended role focusing on financial, Operational and IT audit testing and will be reporting directly to the Director of Internal Audit. Great opportunity to gain cross-over experience into different areas of audit coupled with an amazing work/life balance (NEVER staying past 5:30pm!). Responsibilities: Responsible for independently conducting and documenting complex audit projectsPerforms audit testing verifying the effectiveness of established processes and procedures and verbally communicates and confirms audit findings/observations identified through detailed testing. Develop internal audit scope, perform internal audit procedures, and prepare internal audit reports reflecting the results of work preformed Cover all functional and operating units, focusing on financial, IT and operational processes Perform follow-up on the status of outstanding internal audit issues Play a strong role in providing ongoing internal controls consulting, establishing strong partnerships with management in support of key initiatives Ad hoc projects Required Qualifications: Bachelor's degree in Accounting, Finance, or Business 3+ years of Audit or IT Audit Understanding of internal auditing standards, SOX, COSO and / or risk assessment practices Attainment or progression towards CPA, CIA or CISA a plus Strong organizational and analytical skills Strong working knowledge in using ACL or other data analysis tools Compensation: $70,000 - $90,000 (DOE) + Bonus Great work/life balance Excellent Benefits Hollister Staffing and all its related entities provides equal employment opportunities (EEO) to all employees and applicants for employment without regard to race, color, religion, gender, sexual orientation, gender identity or expression, national origin, age, genetic information, disability, or veteran status or other categories protected by applicable federal, state and local laws governing nondiscrimination in employment in every location in which the company has facilities. This policy applies to all terms and conditions of employment, including recruiting, hiring, placement, promotion, termination, layoff, recall, transfer, leaves of absence, compensation and training.","['audit', 'audit', 'plan', 'audit', 'testing', 'reporting', 'Audit', 'audit', 'audit', 'audit', 'testing', 'audit', 'testing', 'audit', 'audit', 'audit', 'reports', 'audit', 'controls', 'consulting', 'partnerships', 'Accounting', 'Finance', 'Audit', 'Audit', 'auditing', 'analytical', 'analysis', 'Staffing', 'recruiting', 'training', 'internal audit', 'internal audit', 'Internal Audit', 'internal audit', 'internal audit', 'internal audit', 'internal audit', 'internal controls', 'risk assessment', 'analytical skills', 'data analysis']"
348,"Wealth Plan Specialist Wealth management firm located in Northwest Houston seeking an individual that desires to make a positive difference in the lives of its clients.  The Wealth Plan Specialist plays a critical role in the firm.   Responsibilities & Activities:Generate and maintain wealth plans.Create presentations summarizing the wealth plans for client meetings.Coordinate completion of meeting action items with clients and clients’ advisors (CPA’s, Attorneys, etc.).Interact and correspond with clients on documentation.Provide weekly updates on the status of the wealth planning process.Design/obtain case illustrations for life, long term care and disability insurance and coordinate application and underwriting process.Perform investment and product research.Open and process account requestsPrioritize and deliver on most critical issues or activities on a daily basis.Create, maintain and enhance written office systems and procedures. Knowledge, Skills & Abilities:Bachelor’s degree in business administration, accounting, finance, or similar field of study.Minimum of three years of financial planning or public accounting experience.CFP®NASD Series 7 & 63Experience with eMoney software is desired, but not required.Extreme attention to detail.Excellent attitude and an extraordinary client service orientation.A genuine interest in serving and caring for other people.A strong focus on getting the details right and strives for a high level of accuracy.Excellent organizational and time management skills.Ability to handle multiple tasks.Has impeccable follow through.Ability to work independently with limited supervision.Proficient in adobe, word, excel, outlook, powerpoint and internet explorer.","['Plan', 'Plan', 'presentations', 'updates', 'underwriting', 'process', 'administration', 'accounting', 'finance', 'accounting', 'adobe', 'word', 'excel', 'powerpoint', 'client service', 'time management']"
349,"We are in need of a Hospitality Sales Specialist in Reading, OH.  This is a Temp to hire opportunity paying $18-$22 an hour.   The Hospitality Sales Specialist will have the responsibility for generating sales by calling on prospective and current customers, explaining the type of services and products we offer and maintaining an ongoing relationship. Summary: Generate sales by calling on prospective and current customersQuote prices, delivery dates, and payment terms and persuade prospects to buy, using knowledge of company products and servicesComplete order form, including delivery date and credit information. Confirm with the credit department and acceptability of the orderPrepare summary report of activity as required by company operations manual to submit to Sales DirectorMaintain open order reportContact customers on miscues (delayed shipments, shortage of materials, etc.) and explain  Qualifications: A Bachelor's degree or equivalent work experience2 or more years of Inside Sales experienceFriendly and persuasive telephone mannerWorking knowledge of Microsoft Outlook, Word, and ExcelExperience with JD Edwards AS400 preferred  If you meeting the basic qualifications and are interested in this position, please visit www.ajilon.com and apply! ","['Hospitality', 'Sales', 'Hospitality', 'Sales', 'sales', 'sales', 'operations', 'Sales', 'Sales', 'Word']"
350,"JOB SUMMARY:                Serves patients – adolescent and adults, ages 12 -54 with a variety of socioeconomic and cultural backgrounds   PRINCIPAL DUTIES AND RESPONSIBILITIES: Assesses and manages laboring woman’s physical condition/parameters and progress through the labor and delivery, including significant other in the process Assesses fetal well being by means of electronic fetal monitoring and other standard parameters Immediate stabilization of the neonate  Maternal recovery after delivery (vaginal or cesarean section)  Assumes circulating role for vaginal or cesarean section delivery Assesses for and in collaboration with medical staff, stabilizes and evaluates effectiveness of interventions for obstetrical/medical complications such as:·         Pre-term Premature Rupture of Membranes (PPROM) ·         Pre-term Labor (PTL) ·         Pregnancy Induced Hypertension (PIH) ·         Hemolysis Elevated Liver Enzymes and Low Platelets (HELLP) ·         Diabetes ·         Placenta Previa ·         Placental Abruption   Initiates parent infant bonding promoting a baby-friendly environment Assesses learning needs and teaches patient and familyScope of Care: The Family Birth Center (FBC) comprises of 2 floors of the Women's Center. The third floor has twenty-eight (28) beds and a Transition Nursery. The fourth floor has twenty-two (22) beds with the capability to flex up to twenty-eight (28) beds. The fourth floor has the capability of a Transition Nursery. Work Experience: One year experience in high risk L&D.   License/Registration/ Certification: Current RN permit or licensure issued by the Board of Nurse Examiners of the State of Texas to practice professional nursing.Current American Heart Association Healthcare Provider certification required. Current NRP certification required.  Education & Training Completion of an accredited school of nursing program resulting in an Associate Degree, Diploma or Baccalaureate degree in nursing.   Electronic Fetal Monitoring education annually.Skills: Technical, clerical, critical thinking and interpersonal skills relevant to total patient care/area in order to safely and efficiently treat patients.  Good verbal and written communication skills necessary in order to be clearly and easily understood by patients, families and members of the Health Care team.  Writes/prints legibly in order to document accurately and understandably, and to provide direction to support staff and others.  Demonstrates a pleasant, helpful and caring demeanor in order to be an effective patient advocate.    EQUAL OPPORTUNITY EMPLOYER MINORITIES / WOMEN / VETERANS / DISABLED Additional Information:","['process', 'flex', 'Certification', 'Healthcare', 'certification', 'certification', 'Training', 'Technical', 'communication', 'Health']"
351,"These are ENTRY LEVEL positions in Customer Service, Marketing, Advertising, Events, and Public Relations. Comprehensive training and development is provided to every team member in order be SUCCESSFUL in a career path with the company. College graduates are WELCOME!We are hiring for the following positions:Entry-level Management (Paid Training Provided)Customer Service (Paid Training Provided)Marketing to Management (Paid Training Provided)Public Relations (Paid Training Provided)Advertising (Paid Training Provided)Sales (Paid Training Provided)Events**NO SALES, D2D, B2B, OR TELEMARKETING INVOLVED WHATSOEVER!**Must have reliable transportation! RequirementsJOB REQUIREMENTS:1-2 years experience in marketing, sales or communicationsExcellent written and verbal communication skillsAbility to work in a fast-paced environmentLevel headed problem solver with a professional oriented attitudeOrganizational and tracking skills with attention to detailTeam player who also excels as an individual contributorAdaptable, dependable and responsibleBasic understanding of general marketing concepts and sales strategyPosition will be considered for senior campaign management rolesHIRING REQUIREMENTS:ONLY Entry and Junior Level positions available (will train into Management)RELIABLE MEANS OF TRANSPORTATION IS REQUIREDIMMEDIATE / DIRECT HIRE ONLYAPPLY TODAY TO BE CONTACTED FOR AN INTERVIEW","['Marketing', 'Advertising', 'training', 'Training', 'Training', 'Marketing', 'Training', 'Training', 'Advertising', 'Training', 'Sales', 'Training', 'SALES', 'transportation', 'marketing', 'sales', 'communication', 'marketing', 'sales', 'TRANSPORTATION', 'Customer Service', 'Public Relations', 'Customer Service', 'Public Relations']"
352,"Position ID#  76162 # Positions  1 State  CT City  Fairfield Category  Store Associates - Shift Supervisor Store #  10386 Shift  .. The primary purpose of this position is to provide direction and assistance in the completion of daily merchandise and operating tasks and to perform such other duties as assigned by the Store Manager and/or Assistant Store Manager. The incumbent is required to perform all tasks in a safe manner consistent with corporate policies and applicable laws. This position does not involve, hiring, firing, or disciplining associates or recommending any such action. Situations surrounding these issues should be brought to the attention of the Store Manager and/or Assistant Store Manager.   The associate is responsible for the functions below, in addition to other duties as assigned:   • Provide superior customer service by assisting customers with their shopping needs, handling all customer transactions in a timely and courteous manner, and responding to customer complaints/concerns with a sense of urgency to see to their resolution. • Attend to merchandising of plan-o-grams within seasonal departments, end caps, displays and basic inline departments as directed by the Store Manager and/or the Assistant Store Manager. • Control inventory by performing proper receiving and stocking including accurate cycle counting, processing merchandise transfers according to procedures, and reporting inventory problems to the Store Manager and/or Assistant Store Manager. • Accountable for store cash and other financial assets, reconciling cash register drawers, preparing deposits, and ordering changes from the bank as directed by the Store Manager and/or the Assistant Store Manager. • Assist with the general maintenance and appearance of the store by ensuring a safe and pleasing environment for both customers and associates; respond to any unexpected emergencies to ensure the protection of company assets. • Oversee that store inventory is regularly inspected in accordance with the Product Freshness Review Schedule as directed by the Store Manager and/or the Assistant Store Manager. • Ensure that all outdated product and product with less than 30 days until expiration is removed from the sales floor to be processed through the established returns process. • Manage tasks and supervise store associates in those limited circumstances when the Store Manager and/or Assistant Store Manager is unavailable.   Supervisory Experience This position involves managing tasks and supervising store associates in those limited circumstances when the Store Manager and/or Assistant Store Manager is unavailable. This position does not involve, hiring, firing, or disciplining associates or recommending any such action, which should be brought to the attention of the Store Manager and/or Assistant Store Manager.   *All duties described in this document are to be performed in keeping with the core values and service attributes consistent with the Rite Aid brand and strategy. The primary purpose of this position is to provide direction and assistance in the completion of daily merchandise and operating tasks and to perform such other duties as assigned by the Store Manager and/or Assistant Store Manager. The incumbent is required to perform all tasks in a safe manner consistent with corporate policies and applicable laws. This position does not involve, hiring, firing, or disciplining associates or recommending any such action. Situations surrounding these issues should be brought to the attention of the Store Manager and/or Assistant Store Manager.   The associate is responsible for the functions below, in addition to other duties as assigned:   • Provide superior customer service by assisting customers with their shopping needs, handling all customer transactions in a timely and courteous manner, and responding to customer complaints/concerns with a sense of urgency to see to their resolution. • Attend to merchandising of plan-o-grams within seasonal departments, end caps, displays and basic inline departments as directed by the Store Manager and/or the Assistant Store Manager. • Control inventory by performing proper receiving and stocking including accurate cycle counting, processing merchandise transfers according to procedures, and reporting inventory problems to the Store Manager and/or Assistant Store Manager. • Accountable for store cash and other financial assets, reconciling cash register drawers, preparing deposits, and ordering changes from the bank as directed by the Store Manager and/or the Assistant Store Manager. • Assist with the general maintenance and appearance of the store by ensuring a safe and pleasing environment for both customers and associates; respond to any unexpected emergencies to ensure the protection of company assets. • Oversee that store inventory is regularly inspected in accordance with the Product Freshness Review Schedule as directed by the Store Manager and/or the Assistant Store Manager. • Ensure that all outdated product and product with less than 30 days until expiration is removed from the sales floor to be processed through the established returns process. • Manage tasks and supervise store associates in those limited circumstances when the Store Manager and/or Assistant Store Manager is unavailable.   Supervisory Experience This position involves managing tasks and supervising store associates in those limited circumstances when the Store Manager and/or Assistant Store Manager is unavailable. This position does not involve, hiring, firing, or disciplining associates or recommending any such action, which should be brought to the attention of the Store Manager and/or Assistant Store Manager.   *All duties described in this document are to be performed in keeping with the core values and service attributes consistent with the Rite Aid brand and strategy. • In accordance with state law, candidates must satisfy minimum age requirements to sell and/or supervise the sale of alcohol and/or tobacco products. • Ability to pass drug test. • Committed to providing customer service that makes both internal and external customers feel welcome, important, and appreciated. • Ability to preserve confidentiality of information. • Ability and willingness to move with purpose and a strong sense of urgency. • Ability to work weekends on a regular basis. • Ability to work day or evening hours. • Accuracy and attention to detail. • Ability to organize and prioritize a variety of tasks/projects. • In accordance with state law, candidates must satisfy minimum age requirements to sell and/or supervise the sale of alcohol and/or tobacco products. • Ability to pass drug test. • Committed to providing customer service that makes both internal and external customers feel welcome, important, and appreciated. • Ability to preserve confidentiality of information. • Ability and willingness to move with purpose and a strong sense of urgency. • Ability to work weekends on a regular basis. • Ability to work day or evening hours. • Accuracy and attention to detail. • Ability to organize and prioritize a variety of tasks/projects. At least one (1) year of experience in retail, food service, restaurant or customer service industry, preferably at a supervisor level, and/or a two (2) year college degree.        ","['Supervisor', 'policies', 'transactions', 'merchandising', 'inventory', 'reporting', 'inventory', 'deposits', 'ordering', 'inventory', 'Schedule', 'sales', 'process', 'supervising', 'brand', 'strategy', 'policies', 'transactions', 'merchandising', 'inventory', 'reporting', 'inventory', 'deposits', 'ordering', 'inventory', 'Schedule', 'sales', 'process', 'supervising', 'brand', 'strategy', 'retail', 'supervisor', 'customer service', 'Supervisory Experience', 'customer service', 'Supervisory Experience', 'customer service', 'customer service', 'customer service']"
353,"Business / Systems Analyst-Redmond, WA-12 Month ContractDid you know that Gartner positioned CompuCom as a Leader in its Magic Quadrant for End User Outsourcing? Come work for the leader today!Our client is the world's leading software organization seeking a candidate to create, maintain and evaluate diverse business requirements for Service Now Performance Analytics reporting solution.Tasks: * Creating reports and dashboards * Working on the list of reports to be created and self-managing reports getting done * Possibly assisting colleagues in understanding / providing knowledge on the report work * Understanding issues / functions not working properly in production and providing analysisRequirements: * 2-5 years' experience in the creation, updates and maintenance of dashboards; includes creating jobs, sources, indicators, breakdowns, and custom dashboards * ServiceNow experience * Experience working independently and running ServiceNow Performance Analytics requiredPosition is open to out-of-state candidates willing to relocate at their own expense.W2 only, no Corp to Corp. We are unable to sponsor H1B visas at this time.**CompuCom supports Employment Equity and Diversity**CompuCom Systems, Inc., a global company headquartered in Dallas, Texas, provides IT managed services, infrastructure solutions, consulting and products to Fortune 1000 companies committed to enhancing their end users' experience. Founded in 1987, privately held CompuCom employs approximately 11,500 associates. For more information, visit www.compucom.com","['Magic', 'Outsourcing', 'Analytics', 'reporting', 'reports', 'reports', 'reports', 'updates', 'Analytics', 'consulting', 'Business Systems', 'End User']"
354,"Security Officer Job Label:P39 01-012 PIER 39 Hiring Security Officers!  Hiring Bonus of $500 payable after 90 days of employmentPIER 39, San Francisco's Premier Bay Attraction, is a festival marketplace featuring 110 specialty shops, 14 full-service restaurants and numerous fun-filled attractions. PIER 39 is located in San Francisco's Fisherman's Wharf, at Beach Street and The Embarcadero.Be a part of San Francisco’s #1 attraction! PIER 39 is currently seeking Security Officers and Supervisors to join our team.  The ideal candidate will be self-motivated and a highly organized individual, responsible for providing for the physical protection of the PIER 39 premises and the security of its visitors, tenants, employees and property. PIER 39 is an iconic part of San Francisco!  Don’t miss out on this chance to become a member of this professional Security Force. Primary Responsibilities: Serves as a deterrent to crime and rule/policy violations by making continuous patrols of the property.  Writes clear, concise and correct security reports including but not limited to Incident Reports, Accident Reports, Daily Security Logs, Incident Log Entries, Injury Reports and Arrest & Field Interview Reports. Ensures that any undesirable persons are handled effectively without interrupting the orderly flow of operations. Serves as a fire watch and takes necessary action to guarantee the protection of property. Maintains effective working relationships with other departments, companies and employees. Thoroughly patrols the PIER, noting any problem areas or unusual activity. Familiarizes oneself with PIER property and activities, reporting any suspicious behavior to the Watch Supervisor. Enforces PIER Standard Operating Procedures. Notes safety hazards and takes appropriate remedial action. Uses proper radio procedures in accordance with Federal Communications Commission guidelines. Demonstrates diligence in counter-terrorism measures, observations for suspicious packages, devices, or actions by individuals. Performs any other duties requested by the Deputy Chiefs Department Commanders/Captains & Watch Supervisors. PIER 39 is a 45-acre waterfront complex that is a gathering place for millions of San Francisco locals and visitors. In addition to its 14 full-service restaurants, 90+ shops and popular attractions, PIER 39 also has a 5-acre waterfront park and a 300-berth marina. PIER 39 is known for its spectacular views of the Golden Gate and Bay Bridges, Alcatraz Island and the San Francisco city skyline. PIER 39 is also home to the world famous California sea lions. To apply for this position or refer someone you know, please use our online interview system managed by Accolo. Apply for this job Once you have completed the online interview, your information will be forwarded to the hiring authority for decisions on next steps. Related Keywords: Security Officer, Security, Security Guard","['Security', 'Security', 'Security', 'security', 'Security', 'security', 'reports', 'Reports', 'Reports', 'Security', 'Reports', 'Reports', 'operations', 'reporting', 'Supervisor', 'safety', 'system', 'Security', 'Security', 'Security', 'Standard Operating Procedures']"
