,job_description,bag_of_words
452,"Provides respiratory therapy modalities per protocol and those ordered by physicians to improve the cardiopulmonary conditions of patients from neonatal to geriatric ages. Duties include assessment, administration and evaluation of respiratory care treatments, coordinating with physicians on treatment care plans, performing intubations, airway management and provision of life support intra-hospital and inter-hospital transportation to critical patients may include both adult and pediatric patients.  Job Requirement: Education/Experience: Equivalent to graduation from high school and successful completion of an approved school of Respiratory Therapy. The ARCP will be able to complete primary job duties in either PICU or NICU, AND will be able to at least complete job duties as a secondary in the other unit at the time of hire or within 90 days from the hire into this classification. Licensing/Certification Requirements: Credentialed by the NBRC as a Certified Respiratory Therapist (CRT) with 5 years of NICU/PICU primary experience OR a Registered Respiratory Therapist (RRT) with NICU/PICU primary experience at time of hire. Current licensure by the Nevada State Board of Medical Examiners as a Respiratory Care Practitioner. Basic Life Support (BLS) and Pediatric Advanced Life Support (PALS)Certificate From the American Heart Association (AHA). State of Nevada Blood Gas Technologist or Blood Gas General Laboratory Supervisor license at time of hire or within 90 days from date of hire into classification. NRP (AHA) required within 90 days of hire.  Knowledge, Skills, Abilities, and Physical Requirements: Knowledge of: Anatomy and physiology; blood gases; advanced respiratory and cardiology principles; dynamics of aerosol and IPPB therapy; respiratory care modalities for adults, pediatrics and neonatal patients when trained and competent; respiratory drug pharmacology; respiratory care equipment in use at facility; pulmonary rehabilitation techniques; patient acuity assessment methods; Hospital standards of care; department and hospital emergency response policies and practices; patient rights; age specific patient care practices; infection control policies and practices; handling, storage, use and disposal of hazardous materials.Skill in:Using mechanical ventilators; performing arterial blood gas sampling and analysis; applying cardiopulmonary resuscitation; surfactant replacement therapy administration; using computers for data entry and reporting; maintaining airway adjustments; transporting critical patients; maintaining ventilation equipment; communicating with a wide variety of people from diverse socio-economic and ethnic backgrounds; establishing and maintaining effective working relationships with all personnel contacted in the course of duties; efficient, effective and safe use of equipment; establishing and maintaining effective working relationships with all personnel contacted in the course of duties.Physical Requirements and Working Conditions:Mobility to work in a typical clinical environment and use standard equipment, stamina to remain standing and/or walk for extended periods of time, vision to read printed materials and a VDT screen, and hearing and speech to communicate effectively in person and over the telephone. Strength and agility to exert up to 50 pounds of force occasionally, and/or up to 20 pounds of force frequently to move objects, and/or up to 10 pounds of force constantly to move objects. Reasonable accommodations may be made to enable individuals with disabilities to perform the essential functions of this classification. MPUMCLVSMUMCLV  #TrackingJobBody p{margin:10px 0 5px !important;}","['administration', 'transportation', 'Supervisor', 'Hospital', 'hospital', 'policies', 'policies', 'analysis', 'administration', 'reporting', 'p', 'data entry']"
453,"Ebert Engineering Inc.currently has an opening for a civil engineer with background in water and wastewater design.  Candidates should be self-motivated, detail-oriented design engineer with experience in water andwastewater treatment plants, pumping stations, sewers, collection and conveyance systems design and permitting.     Qualifications:B.S. in Civil Engineering.Ability to prepare concept drawings, documents, maps, reports and support documentation.Excellent written and communication skills.Design experience with AutoCAD (A plus but not required).Experience dealing with regulatory agencies and review professionals.Self starter, can work independently and with team members.Must be deadline-oriented, self motivated and able to handle multiple assignments with minimum guidance.Good interpersonal skills to effectively coordinate with clients, government agencies and contractors.Tracking budgets.Good organizational skills.       ","['Engineering', 'design', 'design', 'design', 'reports', 'communication', 'AutoCAD', 'regulatory']"
454,"Security Officer 3828BR Southern California 818-649-7556 Job Description WHELAN SECURITY IS NOW HIRING We are searching for bright and talented professionals to join our world-class security team! Our security positions are ideal for: Former, transitioning and military reserve personnel Former and future law enforcement officers Hospitality and customer service professionals College students Retirees Qualifications Successful candidates must meet the following requirements: Legally authorized to work in the United States At least 21 years of age or older as required by applicable law or contractual requirements Demonstrate a stable work history Pass an extensive background screening which includes, but is not limited to, criminal background checks (local, state and federal), drug test, aptitude tests, skills assessment, interviews, and personality profile (behavioral assessment) Valid CA guard card Education Candidates must meet the following educational requirements: Possess at least a high school education or equivalent (GED) Apply Now! If you have an interest in joining a leader in the contract security industry and would like to work at one or more of our outstanding client locations in the Westminster, CA area – APPLY NOW! Click “Apply” to begin the application process immediately; For more information, you can also call us at 818-649-7556 .  CA PPO # 16344Not convinced?  Listen to what our team members have to say!At Whelan, we value people and we value relationships.Extraordinary people work at Whelan – are you one?Westminster, CA 92683","['Security', 'SECURITY', 'security', 'security', 'Hospitality', 'security', 'Click', 'process', 'law enforcement', 'customer service']"
455,"THE LEBANON UTILITIES is currently looking to hire an individual for the position of Electric Operations Engineer.General Summary:Under the direction of the General Manager, responsible for managerial and administrative work in directing all activities of the Engineering Department of the electric group of Lebanon Utilities.Qualifications:Thorough knowledge and familiarity with principles and practices ofelectric power line construction, maintenance, and substations required. Able to make informed immediate decisions in emergency or highly stressful situations. Experience:Six to eight years electrical transmission/distribution line and substation experience with two to four years in a supervisory capacity. Four year degree in electrical engineering. Two years of related electrical equipment operation experience.Interested parties should submit an application that can be obtained at Lebanon Utilities and a resume with salary history to Human Resources no later than April 25th, 2016.P.O. Box 479, Lebanon, IN 46052NO PHONE CALLS, PLEASE.This job listing brought to you by The Lebanon Reporter","['Operations', 'Engineering', 'construction', 'Six', 'electrical', 'electrical', 'engineering', 'electrical', 'electrical engineering', 'Human Resources', 'PHONE CALLS']"
456,"Emergency Medical Technicians (EMT) $12.00 + $500 HIRING BONUS 3068BR Arizona 602-635-3077 Job Description Emergency Medical Technician (EMT) NOW HIRING!  Whelan Security is searching for bright and talented professionals who wish to share in the unique culture of our family business – one where people feel inspired, encouraged, and rewarded.  We are excited to announce immediate openings in the Phoenix, AZ area! Now is your opportunity to join our world-class team as one of the fastest growing contract security companies in the country! The EMT will respond to all emergency medical situations in a large call center environment and will also be required to perform security duties. Qualifications A successful candidate must meet the following requirements: Legally authorized to work in the United States. At least 21 years of age or older as required by applicable law or contractual requirements. Possess at least a high school education or equivalent (GED). Demonstrate a stable work history.  Pass an extensive background screening which includes, but is not limited to, criminal background checks (local, state and federal), drug test, aptitude tests, skills assessment, interviews, and personality profile (behavioral assessment). Qualified candidates must be currently certified as an EMT and successfully complete all pre-employment testing including physical exam, agility test, written exams, and manual dexterity. Previous contract services, hospitality, military or law enforcement experience is desirable. Education Why Whelan? Be Supported:  Whelan employees enjoy a comprehensive benefits package including health insurance, supplemental benefits (including dental, vision, short term disability, life insurance, and legal assistance plans), 401(k) retirement plan, employee assistance program, prescription discount cards, paid vacations, and more! Be Challenged:  Our extensive training program and career progression opportunities create an environment where employees can thrive, succeed, and enhance their careers. Be Rewarded: We are proud to acknowledge and reward exceptional employees who make a difference to customers, the team, and the organization through our comprehensive Employee Recognition Program. Be Valued: We are more than a team – we are a family! The distinctive culture of our family business sets us apart from every other contract security company in the industry.  Apply Now!If you have an interest in joining a leader in the contract security industry and would like to work at some of our outstanding client locations in the Phoenix area – APPLY NOW!Click “Apply” to begin the application process immediately. For more information, you can also call us at 602-635-3077.Not convinced? Listen to what our team members have to say!At Whelan, we value people and we value relationships.Extraordinary people work at Whelan – are you one? HP123SOSPhoenix, AZ 85040","['Security', 'security', 'security', 'testing', 'hospitality', 'health', 'legal', 'plan', 'training', 'security', 'security', 'Click', 'process', 'call center', 'law enforcement']"
457,"Commercial Specialty Contractor is seeking an experienced Drywall Estimator ($50K-$90K) Our client, the leading specialty contractor in Texas for interior construction in the commercial sector, has an established reputation for quality from decades of delivering projects successfully and efficiently. With services that include drywall, framing, acoustical ceilings, flooring, wall coverings, doors, and window treatments, their pipeline of work and presence in the market continues to grow. As a result, they are currently looking for an experienced Drywall Estimator to join the team. Your 3-5 years of experience specifically with drywall estimation for new, ground-up construction projects will be critical. You will be adept in handling on-screen take offs, preparing bids, driving new business, interfacing with clients, and coordinating with project managers and others to ensure successful execution and delivery. Familiarity with OST, Quick Bid, and Bluebeam will help assimilate into the technology platform. Culturally, this company is completely dedicated to one crucial aspect. Teamwork. Expect a collaborative forum between all facets of the company, from the field to the CEO. Everyone works together and supports efforts across product lines and departments to create success. This formula is showcased by the extensive tenure many of the employees have spanning 10, 20, and 30 years. In return for your efforts, they are offering a competitive salary of $60K-$90K based on experience, discretionary bonuses, medical benefits and an established growth plan to promote into leadership. Also outside of work, many of the employees participate in a variety of events and activities further building the team culture. To inquire about this role, please forward your resume and call 346-980-4912 to have a confidential chat about the details.","['construction', 'construction', 'plan']"
458,"CITY OF SOLONPOLICE OFFICER CIVIL SERVICE EXAMINATIONThe City of Solon will be establishing a list of candidates for the position of police officer for the Solon Police Department. Testing for this position, which includes written, personality inventory, and physical agility, will be conducted by the Cuyahoga Community College (Tri-C) through their Standardized Testing Program for Police Officers on Sunday, July 24, 2016. The Solon Civil Service Commission will establish a certified list of police officer candidates based on the results of the testing performed by Tri-C and giving bonus credit for Military Service (10%) OPOTA Certification (5%) and College education - 2% credit with copy of Associate's Degree or 4% credit with copy of Bachelor's Degree (cannot receive 6% for both).Qualified candidates must have at least a high school diploma or GED, have attained the age of twenty-one (21) by date of written examination, have valid driving privileges, be of good moral character with no history of felony or serious misdemeanor offenses, and possess an excellent work ethic and service-oriented attitude. In addition, candidates will be required to successfully complete a background investigation, truth analysis, full psychological exam, and medical exam.Those interested should go to the Solon Police Department to pick up a Tri-C test packet, or download the packet from the City of Solon website. Interested candidates should also possess a passing agility test certificate by July 24, 2016. Certificates will be accepted if issued any time after July 25, 2015. The City of Solon is an Equal Opportunity Employer and does not discriminate on the basis of race, color, national origin, gender, religion, age, and handicap status in employment or provision of services. All information received is subject to the public record laws of the State of Ohio. Solon Police Department33000 Solon RoadSolon, OH 44139DATE POSTED: June 10, 2016Source: Akron Beacon Journal","['Testing', 'inventory', 'Testing', 'testing', 'Certification', 'investigation', 'analysis', 'website']"
459,"Location: Spokane, WAOverview:  Responsible for fulfilling the Company’s service objectives by providing prompt, accurate and courteous service to agents, policyholders, and business partners concerning policy transactions, renewals, customer inquiries, and requests for information. Utilizing the Company’s automated systems, the Assistant Underwriter will respond to inquiries concerning policy transactions, renewals, policy coverage, premium billings and payment status, basic policy information, routine and coverage questions. The Assistant Underwriter will have an individual level of underwriting authority as assigned by CSBP Management. This person will be required to hold a current Property & Casualty license. This position represents the “front-line” of customer service and customer perceptions and is critical in demonstrating the Company’s commitment to complete customer satisfaction.Essential Duties:Process renewals, endorsements and other transactions as needed to meet the needs of the CSBP department. Complete pre-renewal reviews as assigned. Document the transactions as directed by department procedures.Understand Commercial and Ag policy forms, coverages, and processes as assigned.This position responds to incoming calls through the Company’s automated-calling system and requires active listening skills to assess customer needs, inquiries, and information. The incumbent must identify the nature of the call, assist the caller by completing policy transactions, determine appropriate coverage, and respond to payment, billing, and policy inquiries. Calls of a complex or technical nature may need to be referred to a Lead, Supervisor, appropriate department or business function for assistance and resolution.Accept payments over the telephone per billing system mandates and Company financial guidelines. Substantiate receipt of payment and confirm payment verification to the policyholder or agent.Respond to agents, policyholders, and business partners concerning CIG billing policies and procedures.Maintain accurate documentation of all customer inquiries by noting CIG systems according to CSBP processes. The Assistant Underwriter must document all pending issues and service actions for follow-up as required by CSBP processes.May perform outbound-calling activities and conduct customer surveys to determine customer satisfaction, verify policy information, or update customer history information, as deemed necessary to fulfill the department service objectives and the delivery of quality customer service. In addition, the Assistant Underwriter may perform systematic calling initiatives that increase or enhance the customer relationship as well as provide enhanced benefits for the customer, as directed by CSBP Management.Qualifications:Strong communications skills are required along with the ability to speak and write grammatically correct English. All candidates must have basic knowledge of insurance and policy information, business mathematics, and excellent customer service skills. The position requires accurate and articulate individuals who are comfortable interacting with a diverse group of customers and who may have varying degrees of sophistication and understanding regarding insurance products and services. This position involves extensive use of telephone equipment, computers, peripheral equipment, and specialized software or databases. Incumbents must possess an exceptional ability to perform detailed work accurately and consistently.Education and Experience:All candidates must have the equivalent of a high school diploma. Associates Degree or higher preferred. Must hold a valid Property & Casualty license in the state of residence and maintain ongoing insurance continuing education courses. As needed or required, may secure P&C licenses in other states. Candidates should possess two to five years of work experience within the insurance industry in Commercial or Ag Lines.Attention: Human Resources cighr@ciginsurance.com EEO/M/F/V/H","['transactions', 'requests', 'transactions', 'underwriting', 'Process', 'transactions', 'transactions', 'system', 'transactions', 'billing', 'technical', 'Supervisor', 'payments', 'billing', 'system', 'billing', 'policies', 'documentation', 'English', 'mathematics', 'P', 'C', 'customer service', 'customer service', 'customer service', 'Human Resources']"
460,"Superintendent with KB Home  KB Home, a Fortune 500 NYSE company and one of America's premier homebuilders, has an immediate employment opportunity available. The Company operates in numerous states across the nation from California to Florida. KB Home has been building homes for a half a century, and was recently named to Fortune magazine's list of the World's Most Admired Companies for the sixth consecutive year. KB Home ranked #1 for 'Innovation' among homebuilders. Also, KB Home was given an Award for Excellence for the Energy Star Efficiency program by the U.S. Environmental Protection Agency. In 2008, KB Home became the first builder to earn the prestigious National Housing Quality (NHQ) Certified Builder Program for all of its operations nationwide. Manages all functions of the construction job site as it relates to building quality residential homes. Supervise construction from dirt through closing while maximizing profits and maintaining excellence through the KBnxt business model. Ensures quality assurance and customer satisfaction are maintained throughout the construction process.   ESSENTIAL DUTIES AND RESPONSIBILITIES:-Plan and direct KB staff and trade partners in the construction and completion of quality residential homes with strong commitment to executing the KBnxt business model and 100% Complete/100% Satisfied program. - Responsible for milestone report (slab to frame, frame to mechanical, drywall to cabinet and cabinet to final). -Ensure consistent application of “Even Flow”, homes completed per schedule (daily starts, closings and monthly deliveries).-Schedule and monitor trade partners during the entire construction process from start to closing. Informs and trains trade partners regarding company policies and procedures, including safety and OSHA compliance.-Approve trade partner’s purchase orders and invoices for assigned homes, while ensuring completion of work in a quality and timely manner. Maintains trade partner scorecards on performance and submits to purchasing.-Monitor subdivision cleanliness and hold trade partners responsible for daily clean-up.-Interact with Architecture, Engineering, Studio, Purchasing and DUP and consider their input/deadlines during the process to ensure timely quality construction.            -Continually strive for superior JD Power/CSI ranking in specific market.-Responsible for executing all home deliveries 100% complete and signed off by COE by the homebuyer.-Monitor and resolve customer or construction concerns to facilitate smooth final closing process.-Deliver Pre-Construction and Pre-Drywall orientations with buyers to reinforce contact with buyer throughout the construction process.-Deliver a consistent and effective homeowner orientation to ensure the buyer experiences a positive transition to their new home.-Participate in Community Teams, and take ownership of construction matters/issues.  Works directly with the salesforce with an emphasis in teamwork and customer satisfaction.              -Maintain a safe work site by implementing good housekeeping regulations and safety requirements, enforcing safe work habits and observing OSHA and any state-level agencies’ regulations.-Facilitate weekly safety meetings with staff and trade partners -Ensure Quality Checkpoints are completed and provides daily status updates on the construction progress on each unit.-Manage the installation and maintenance of SWPPP for the construction site.          External Partnerships (trade partners, municipalities, building officials):-Ensures the community is working with NHQ certified trade partners-Drives the permit and inspection sign-off process on a timely basis-Responsible for inspection process in assigned homes and interacts with VA, FHA, City, County, State and Conventional inspectors involved in the homebuilding process           EDUCATION REQUIREMENTS: -High school degree or equivalent required-Associates or Bachelors degree preferred-Construction Management vocational degree or certificate preferred  EXPERIENCE REQUIREMENTS:-2 - 5 years of construction experience with a production homebuilder-Strong experience in delivering high quality customer service programs. JD P experience a plus!-Demonstrated leadership capabilities including motivating teams, employee development, and being results oriented-Strong people skills, including the capability to handle various personalities and develop professional relationships-Action oriented, with the drive to push projects and tasks to successful closure-Proven ability of being customer centric by seeking solutions from the customer’s perspective-Strong verbal & written communication, with the ability to take complex concepts and communicate accurately and persuasively-Strong ability to work within a team-setting, inclusive of other’s ideas, and a willingness to cooperate-Makes quick and accurate decisions based heavily on facts, data and/or metrics-Proficient in Microsoft applications, including Word, Excel, Powerpoint and Outlook.  -Work full-time schedule with flexibility for overtime when necessary-Ability to work the “On-Call” program when needed (respond to emergency calls or other issues during off-hours)-Local travel required within designated region-Conduct business in a professional and ethical manner to potential buyers, trade partners, external officials, and coworkers to reinforce goodwill and profitability for the company  Find out why KB Home is attracting and retaining the best employees! If you are interested and qualified, please apply now. KB Home provides above average compensation packages and earnings potential, full benefits, an outstanding 401K matching program, bonus plans and amazing promotional opportunities. KB Home is an equal opportunity employer committed to hiring a diverse work team. Diversity is important to KB Home!","['operations', 'construction', 'construction', 'construction', 'process', 'construction', 'schedule', 'construction', 'process', 'policies', 'safety', 'invoices', 'Architecture', 'Engineering', 'Purchasing', 'process', 'construction', 'construction', 'construction', 'construction', 'salesforce', 'regulations', 'safety', 'safety', 'updates', 'construction', 'installation', 'construction', 'Partnerships', 'process', 'process', 'process', 'construction', 'P', 'communication', 'Word', 'Excel', 'Powerpoint', 'schedule', 'travel', 'quality assurance', 'purchase orders', 'customer service']"
