,job_description,bag_of_words
397,"POSITION PROFILE:Staffs and professionally develops a sales team of direct reports (primarily AE) and assists them in career planning. Directs and manages the sales activities and performance of the team. Drives business results by achieving revenue equipment contribution targets. Leverages the customer base and champions the expansion of services across the business line.JOB DUTIES AND RESPONSIBILITIESLeads, motivates, and counsels the sales team, to meet or exceed budgeted sales revenue, gross profit, unit placement, expense and equipment contributions projections while maintaining teamwork and the highest level of customer service.Responsible for up to $3-$4.8 million for revenue expectations and for selling expense limitations.Plans, coaches, trains, advises, and reviews with individual sales representative their progress in achieving individual and team revenue targets and assist them in their career planning, training and growth; recommends and facilitates appropriate development opportunities.Manages SMART process through Account Planning sessions, territory reviews, RAPs, Sales Manager RAP and GOAL Setting.Schedules and hosts periodic informational team meetings and team-building exercises. Supports and advocates headquarter initiatives.Manages day-to-day employee relations' issues.Aligns sales representative's approach and customer understanding with RICOH's strategic direction.Facilitates a team-based, inclusive work environment to promote sales across the business line and drive employee and customer retention.Ensures reports are conducting strategic account planning with key customer accounts.Builds Tier 2 account structure and territories for sales representatives.Recruits, interviews and hires sales professionals.Works with customer and appropriate internal staff to resolve customer issues and complaints.Proactively builds an internal and external pipeline of sales representative candidates and introduce RICOH's products and services via outreach efforts.Evaluates performance data.Participates in fiscal year business planning.Measures success of cross business line salesFacilitates communication and cooperation between team and marketplaces.Performs other duties as assigned.QUALIFICATIONS (Education, Experience, and Certifications)Typically Required:4-year college degree or equivalent in a related field.3 years industry related sales experience with sales management experience.Ricoh is an EEO/Affirmative Action Employer -- Minorities/Women/Protected Veterans/Disabled.","['sales', 'reports', 'sales', 'sales', 'sales', 'sales', 'training', 'process', 'Sales', 'sales', 'sales', 'reports', 'sales', 'sales', 'sales', 'outreach', 'communication', 'sales', 'sales', 'employee relations', 'sales experience', 'sales management']"
398,"Provide proposal development support for P&W's Military Engine Sustainment programs supporting F117 contracts. Activities include interfacing with the Program Office team to evaluate requests for proposals, determining requirements, developing execution details and writing of technical volumes and pricing volumes. Other key activities involve working with our commercial counterparts to compile and analyze price reasonability data to support the proposal pricing. Ability to work with teams of different functional and technical background is essential. A knowledge of FAR 15 and FAR 12 contracting is helpful. Bachelor's degree in business, accounting, finance are acceptable if the individual can demonstrate a history of the skills noted above.MS Office, Government Contracting / proposal writing, Subcontracting/Subcontract Management, strong interpersonal skills, conflict resolution skills, Project/Program ManagementCDI Corporation is an EEO/An Affirmative Action M/F/D/V Employer.","['proposal', 'P', 'contracts', 'requests', 'writing', 'technical', 'analyze', 'proposal', 'technical', 'accounting', 'finance', 'proposal', 'writing']"
399,"LOCATION: Portage JOB TYPE: Contract to Hire - Full Time SHIFT: Second Shift JOB ID: 85716 PAY: $11.47 PROFESSION: Manufacturing/Production DATE POSTED: 5/13/2016 Summary: Growing Company in Portage has Contract to hire positions for Machine Operators on 2nd Shift. Hours are 2:30pm-11:00pm, Monday-Friday with overtime and varying start and end times during peak seasons. Pay starts at $11.47per hour. You may be eligible for pay increases and other benefits if hired on, after 520 hours! Advancement opportunities available! Responsibilities: Monitor the machine that is cutting the product Takes measurements and calculations of product Set up and tear down machine when needed Help maintenance troubleshoot problems with the machines Other duties as assigned Qualifications: Two years recent heavy industrial experience required Mechanically inclined and able to do repetitive work Requires good math, reading, and paperwork skills Someone who takes initiative and cares about their work Previous machine operation preferred M4",['math']
400,"TecNiq Inc, a fast growing leader in LED lighting design and manufacturing, is seeking an ambitious, self-motivated individual to join our Engineering Department in circuit board layout. Qualified individuals of all skill levels are encouraged to apply. Successful candidates should possess the following skills and attributes:·         Associates degree with a minimum of (2) years of experience in circuit board design and layout.·         Knowledge to design single-sided, double-sided and multi-layered PCBs using industry standard techniques, ensuring considerations for DFM/DFT have been made.·         Ability to work in a fast paced results oriented engineering environment.·         Responsible for completing PCB designs in accordance with agreed project time, cost, quality, and performance requirements.·         Effectively communicate and coordinate with other team members (EE, ME, Manufacturing and Fabrication vendors).·         ECAD library administration including symbol, footprint generation and database administration.·         Support development of Bills of Materials.·         Experience with Mentor Graphics schematic capture called Dx Designer and PADs version 9.5 layout software a plus.  Competitive salary based on experience and skill levelBenefits include medical, dental, vision, short-term and long-term disability, life insurance and 401K  Submit resume to tomo@tecniqinc.com ","['lighting', 'design', 'Engineering', 'design', 'design', 'engineering', 'Fabrication', 'vendors', 'administration', 'database']"
401,"Tetra Tech is a leading provider of consulting, engineering, and technical services worldwide. Our reputation rests on the technical expertise and dedication of our employees?16,000 people working together across disciplines and time zones to provide smart, sustainable solutions for challenging projects. We are proud to be home to leading technical experts in water, environment, infrastructure, resource management, energy, and international development. Tetra Tech combines the resources of a global, multibillion dollar company with local, client-focused delivery in 400 locations around the world. We offer competitive compensation and benefits and are searching for innovative people to join our teams. We are currently seeking multiple Security Specialists to join our San Diego project location (positions are pending contract award).  The ideal candidates will have administrative experience supporting Government/Navy Security duties and protocols in personnel, physical, information and operations security programs.   Duties will include a variety of business and administrative functions supporting Security Operations such as:  Prepare or assist in the coordination and support of specialized department programs;  Maintain and modify computer-based records and reports of functional area or department;  Prepare original correspondence or documents;  Check records and reports for accuracy and make appropriate changes;  Collect, classify and maintain hard copy and electronic department files;  Deliver and pick up correspondence and report within the customer?s facilities and from other local offices;  May maintain classified material log following clearly defined classified document procedures and act as a courier for classified documents;  Perform general clerical duties, answer phones, filing, and operation of reproduction and fax machines;  May assist other departments with related tasks. High school diploma or GED completion, and a minimum of four years of related experience or equivalent combination of education and/or training and experience. Preferred:  DSS Security Fundamentals Professional Certification. Possess excellent written and verbal communication skills.   Must be proficient in Microsoft Suite:  Word, Excel, Power Point and Outlook.  Must possess a current active DoD Secret or above clearance; U.S. Citizenship required.  For more information on our company, please visit our website at www.tetratech.com To apply, please submit your resume and cover letter on the Careers portion of our website at www.tetratech.com/careers We thank all applicants for their interest; however only those selected for an interview will be contacted. Tetra Tech is committed to creating a diverse environment and is proud to be an Equal Opportunity Employer. We invite resumes from all interested parties including women, minorities, veterans and persons with disabilities. Tetra Tech is a VEVRAA federal contractor and we request priority referral of veterans for available positions. EOE AA M/F/Vet/Disability - No calls or agencies  ","['consulting', 'engineering', 'technical', 'technical', 'technical', 'international', 'Security', 'Security', 'protocols', 'operations', 'security', 'Security', 'Operations', 'reports', 'correspondence', 'reports', 'correspondence', 'filing', 'training', 'Security', 'Certification', 'communication', 'Word', 'Excel', 'website', 'website', 'resource management']"
402,"Business Development Manager 3566BR Ohio (859) 957-1774 Job Description Whelan Security is looking for a talented and ambitious leader to drive exceptional service and profitable business in the Cincinnati area! Whelan Security is a performance-based company that cares deeply about maintaining our conservative business culture.  The BDM is responsible for new sales by prospecting for new clients through networking and cold calling.  The BDM is also responsible for qualifying and adding new prospects to the database on a regular basis.  Once prospects are qualified, the BDM will lead account planning and generate proposals, pricing and presentations.  Once contract is sold, the BDM will help to manage the transition process and maintain an open line of communication with the client for future rate increase discussions.  The BDM is expected to build upon a culture of employee engagement and set the example for all employees in the branch of servant leadership and personal commitment to the Whelan Values. Qualifications Performance Metrics: The BDM is expected to achieve the following metrics within Whelan’s performance-based business environment: Year over year growth in revenue in the branch Personally sell new accounts in the branch to meet/exceed budgeted sales goals Become proficient in all company database software Add at least five new qualified prospects to database each month Meet with a minimum of five prospects each week Generate a minimum of three proposals each month Close a minimum of one new contract per month (after training period) 100% compliance to the Whelan Mandatory Requirements Lead by example of living up to the Whelan Values Personal Characteristics: Company-Wide Culture - High Integrity (Character Beyond Reproach), Servant Leader (Never Asking Anyone to Do What You Aren’t Willing to Do), Hands-On Leader, Financially Prudent, Detail-Oriented, Thick-Skinned, Fun.  Position-Specific - Fiercely Competitive (Hates to Lose), Rainmaker, Maverick, Good with Numbers, Excellent Writer. Education Why Whelan? Be Supported: Whelan employees enjoy a comprehensive benefits package including major medical insurance, supplemental benefits (including dental, vision, short term disability, life insurance, and legal assistance plans), 401(k) retirement plan, employee assistance program, prescription discount cards, paid vacations, and more! Be Challenged: Our extensive training program and career progression opportunities create an environment where employees can thrive, succeed, and enhance their careers. Be Rewarded: We are proud to acknowledge and reward exceptional employees who make a difference to customers, the team, and the organization through our comprehensive Employee Recognition Program. Be Valued: We are more than a team – we are a family! The distinctive culture of our family business sets us apart from every other contract security company in the industry.  Apply Now! If you are looking for an outstanding opportunity to work at a family-owned, industry leading organization – APPLY NOW!Click “Apply” to begin the application process immediately; or if you wish to expedite your application, we encourage you to visit our local branch office located at 541 Buttermilk Pike, Suite 203, Crescent Springs, KY to apply in person.  For more information, you can also call our branch office at 859-957-1774.Not convinced? Listen to what our team members have to say!Crescent Springs, KY 41017","['Security', 'Security', 'sales', 'prospecting', 'networking', 'database', 'presentations', 'process', 'communication', 'engagement', 'Metrics', 'metrics', 'sales', 'database', 'database', 'training', 'compliance', 'legal', 'plan', 'training', 'security', 'Click', 'process', 'Business Development', 'employee engagement', 'Performance Metrics', 'sales goals']"
403,"BioMed Central, a part of Springer Nature, is the leading open access publisher of STM (Science, Technology and Medicine) research. Unlike traditional publishers, BioMed Central believes research should be free to access for anyone. Since it was founded in 2000, BioMed Central has successfully pioneered the open access publishing model and brought open access to the mainstream. BioMed Central is a vibrant and innovative open access publisher. An imprint of Springer Nature, one of the world’s leading global scientific and medical publishers, we operate in a fast-paced and high-energy environment, with staff based in Europe, Asia and the Americas. Our publishing team is responsible for driving the growth of our business through strategic journal development and acquisitions, upholding rigorous editorial standards, maintaining strong relationships with external customers, and effecting the smooth running and promotion of the journal portfolio through liaison with internal colleagues.  We work closely with leading academics and policy makers, and remain close to the cutting-edge of scientific and medical advances, while gaining exposure to all aspects of the academic journal publishing industry. Job Duties The Journal Development Editor role is ideally suited to a talented and proactive individual who is passionate about science, technology, medicine and open access. Strategic thinking, excellent communication skills and the ability to build strong relationships are key to success in this exciting and varied position. As the primary publishing contact for a portfolio of open access titles in the health sciences, the successful candidate will be responsible for growing and developing their journal cluster, and ensuring exceptional service to our authors, reviewers and other external stakeholders. Specific responsibilities of the Journal Development Editor include: Develop and maintain excellent working relationships with academic Editors, Editorial Boards, society executives and other key contacts in the field, with the aim of building and maintaining our journals’ reputations and increasing submissions; organise and host Editorial Board meetings Build knowledge of the field and the relevant scientific communities to identify journal development opportunities and translate them into actions to maintain a competitive advantage Represent the company at local and international conferences to improve market knowledge, to network within the community, receive feedback on the journals, and to promote BioMed Central journals and open access Produce and implement strategic development plans for the journals and handle contract renewals Plan and drive the commissioning of content, including proactively suggesting topics Monitor peer-review performance for the portfolio and assist colleagues in dealing with author queries or problem manuscripts Ensure journals are promoted through all relevant avenues Work with other team members to identify opportunities for acquiring journals Other duties as required by manager Job Requirements Educated to degree level in a public health, health science, biomedical or clinical subject area Knowledge of journal publishing process and related matters, and understanding of and interest in open access publishing Highly customer-focused, with excellent communication and influencing skills Experience of developing and maintaining productive and friendly relations/partnerships with academic and industry-based researchers Excellent time management and organisational skills; including proven ability to take ownership to drive and complete tasks, to meet deadlines consistently, and adapt quickly to change Excellent critical appraisal, analytical and problem solving skills Strong attention to detail/high accuracy Developed knowledge of the health sciences field Previous experience working in the publishing industry Springer Nature is a leading global research, educational and professional publisher, home to an array of respected and trusted brands providing quality content through a range of innovative products and services. Springer Nature is the world’s largest academic book publisher, publisher of the world’s highest impact journals and a pioneer in the field of open research. The company numbers almost 13,000 staff in over 50 countries and has a turnover of approximately EUR 1.5 billion. Springer Nature was formed in 2015 through the merger of Nature Publishing Group, Palgrave Macmillan, Macmillan Education and Springer Science+Business Media.           We offer a comprehensive benefits package that includes: - Medical, Dental and Vision - Life and AD&D - 401(k) - Flexible Spending Accounts - Transit Accounts - Tuition Assistance - Summer Hours Springer Nature is an Equal Opportunity Employer that complies with the laws and regulations set forth in the following EEO Is The Law Poster: http://www.dol.gov/ofccp/regs/compliance/posters/pdf/eeopost.pdf.   Additional Information:Position Start Date: 2016-05-09Position End Date: 2017-05-10","['access', 'research', 'research', 'access', 'access', 'publishing', 'access', 'access', 'publishing', 'acquisitions', 'editorial', 'publishing', 'access', 'communication', 'publishing', 'access', 'health', 'Editorial', 'Editorial', 'international', 'access', 'Plan', 'commissioning', 'content', 'queries', 'health', 'health', 'publishing', 'process', 'access', 'publishing', 'communication', 'analytical', 'health', 'publishing', 'research', 'content', 'research', 'Publishing', 'regulations', 'public health', 'time management']"
404,"IT Analyst 3875BR Corporate 314-644-3227 Job Description Whelan Security is looking for a talented and driven leader to coordinate IT activities at our corporate office in St. Louis, MO! Whelan Security is a performance-based company that cares deeply about maintaining our conservative business culture. The IT Analyst will have responsibility for organizing and coordinating the use of office technology throughout our corporate and branch offices. Qualifications DUTIES AND RESPONSIBILITIES Responsible for user setup and administration and computer infrastructure management Manage outsourced IT vendor Coordinate acquisition and disposal of computer hardware Track all computer hardware Make recommendations to the Executive team regarding the use and implementation of new technology Office 365 user set up and administration Office, cell phone and internet administration Implement and administer new company wide phone system Manage outsourced phone system provider Copier, fax set up and administration All other duties as assigned by management EXPERIENCE & REQUIREMENTS Legally authorized to work in the United States At least 21 years of age or older as required by applicable law or contractual requirements Demonstrate a stable work history Pass an extensive background screening which includes, but is not limited to, criminal background checks (local, state and federal), drug test, aptitude tests, skills assessment, interviews, and personality profile (behavioral assessment) Possess a valid driver’s license Possess 2-3 years IT experience KNOWLEDGE & ABILITIES Highly organized Self-motivated and displays a high sense of urgency Stable work history Excellent communication skills Acts with integrity Resilient and Adaptable Demonstrated ability to develop relationships at all levels Intellectually astute with strong drive for results Display process driven mentality Education EDUCATION Bachelor’s Degree or equivalent experience preferred Why Whelan?  Be Supported:  Whelan employees enjoy a comprehensive benefits package including health insurance, supplemental benefits, (including dental, vision, short term disability, life insurance, and legal assistance plans), 401(k) retirement plan, employee assistance program, prescription discount cards, paid vacations, and more! Be Challenged:  Our extensive training program and career progression opportunities create an environment where employees can thrive, succeed, and enhance their careers. Be Rewarded:  We are proud to acknowledge and reward exceptional employees who make a difference to customers, the team, and the organization through our comprehensive Employee Recognition Program.Be Valued: We are more than a team – we are a family! The distinctive culture of our family business sets us apart from every other contract security company in the industry. Apply Now! At Whelan, we are passionate about our employees. If you have a passion for people and wish to join a family-owned, industry leading organization – APPLY NOW!Not convinced? Listen to what our team members have to say!P456HQJSt. Louis, MO 63144","['Security', 'Security', 'administration', 'acquisition', 'hardware', 'hardware', 'administration', 'administration', 'system', 'system', 'administration', 'communication', 'process', 'health', 'legal', 'plan', 'training', 'security', 'management EXPERIENCE']"
405,"Security Officer 3410BR Washington 253-237-0582 Job Description WHELAN SECURITY IS NOW HIRING We are searching for bright and talented professionals to join our world-class security team! Our security positions are ideal for: Former, transitioning and military reserve personnel Former and future law enforcement officers Hospitality and customer service professionals College students Retirees Qualifications Successful candidates must meet the following requirements: Legally authorized to work in the United States At least 21 years of age or older as required by applicable law or contractual requirements Demonstrate a stable work history Pass an extensive background screening which includes, but is not limited to, criminal background checks (local, state and federal), drug test, aptitude tests, skills assessment, interviews, and personality profile (behavioral assessment) Education Candidates must meet the following educational requirements: Possess at least a high school education or equivalent (GED) Apply Now! If you have an interest in joining a leader in the contract security industry and would like to work at one or more of our outstanding client locations in the Seattle area – APPLY NOW! Click “Apply” to begin the application process immediately . For more information, you can also call us at 253-237-0582 . Not convinced?   Listen to what our team members have to say! At Whelan, we value people and we value relationships.Extraordinary people work at Whelan – are you one? Seattle, WA 98104","['Security', 'SECURITY', 'security', 'security', 'Hospitality', 'security', 'Click', 'process', 'law enforcement', 'customer service']"
